#AÑO,CODFUNCION,CODECOPART,NOMPARTIDA,Inicial,Actual,O
2017.0,2412,22608,DIA CONTRA LA VIOLENCIA DE GENERO,1500.0,1500.0,1924.85
2017.0,2412,22609,DIA INTERNACIONAL MUJER Y PLAN IGUALDAD,8000.0,14698.0,10866.62
2017.0,2412,22698,DESPLAZAMIENTOS A CENTRO DE ACOGIDA,0.0,0.0,48.4
2017.0,2412,22699,GTOS. CORRIENTES IGUALDAD Y CAVI,3000.0,3000.0,0.0
2017.0,2412,22700,LIMPIEZA EDIFICIOS MUJER,14434.44,14434.44,13231.57
2017.0,2412,24000,EDICIONES Y PUBLICACIONES CONCEJ. IGUALDAD,700.0,700.0,679.42
2017.0,2412,48000,SUBVENCIONES ASOCIACIONES DE MUJERES,3000.0,3000.0,0.0
2017.0,2412,48001,PREMIOS DIA INTERNACIONAL DE LA MUJER,500.0,500.0,400.0
2017.0,2412,62500,EQUIPAMIENTO VIVERO DE EMPRESAS IGUALDAD,1000.0,1000.0,0.0
2017.0,311,21200,MANTENIMIENTO EDIFICIOS DE SANIDAD,0.0,0.0,61.46
2017.0,311,22609,TALLERES Y CHARLAS DIVULGATIVAS SANIDAD,14180.0,406.0,0.0
2017.0,311,22700,"DESRATIZACION, DESINSECTACION Y DESINFECCION",15000.0,15000.0,14150.85
2017.0,311,22701,MTO. Y ACTUALIZACION MICROCHIPS-COLEGIO VETERINARI,650.0,650.0,0.0
2017.0,311,22702,LIMPIEZA EDIFICIOS SANIDAD,7514.16,7514.16,6887.98
2017.0,311,22788,"(R.E.) DESRATIZACION, DESINSECTACION Y DESINFECC.",0.0,1180.0,1180.0
2017.0,311,24000,EDICION DE CARTELES Y FOLLETOS SANIDAD,0.0,0.0,387.2
2017.0,311,48000,CONVENIO GESTION AMBULANCIA CRUZ ROJA,51500.0,53000.0,53000.0
2017.0,311,62500,EQUIPAMIENTO SANIDAD,8726.0,14360.28,14360.28
2017.0,311,62588,(R.E.) EQUIPAMIENTO SANIDAD,0.0,286.77,286.77
2017.0,320,12005,RETRIB. BASICAS EDUCACION-E,78718.64,48718.64,79039.68
2017.0,320,12100,COMPLEMENTO DESTINO EDUCACION,36342.6,36342.6,26204.31
2017.0,320,12101,COMPLEMENTO ESPECIFICO EDUCACION,67532.14,38131.48,49085.52
2017.0,320,13100,PERSONAL LABORAL TEMPORAL EDUCACION,12201.0,12201.0,0.0
2017.0,320,15000,PRODUCTIVIDAD FUNCIONARIOS EDUCACION,6847.25,6847.25,5676.42
2017.0,320,16000,SEGURIDAD SOCIAL FUNCIONARIOS EDUCACION,48468.75,48468.75,31718.88
2017.0,320,16001,SEG. SOCIAL PERSONAL LABORAL EDUCACION,201.32,201.32,0.0
2017.0,321,21200,MTO. COLEGIOS,20000.0,20000.0,21719.93
2017.0,321,21288,(R.E.) MANTENIMIENTO COLEGIOS,0.0,41.55,41.55
2017.0,321,22100,ENERGIA ELECTRICA EDIFICIOS EDUCACION,78000.0,78000.0,72870.18
2017.0,321,22103,COMBUSTIBLE CALEFACCION C.E.I.P.,24000.0,24000.0,26316.84
2017.0,321,22700,LIMPIEZA EDIFICIOS EDUCACION,360845.52,360845.52,330775.06
2017.0,321,22707,GESTION ESCUELA INFANTIL GLORIA FUERTES,278344.06,278344.06,278343.96
2017.0,321,22708,GESTION ESCUELA INFANTIL NUMERO 2,46647.18,647.18,0.0
2017.0,321,22709,GESTION C.A.I. LOS CEREZOS,119352.82,119352.82,119352.82
2017.0,321,60091,COMEDOR Y SALON USOS MULTIPLES CEIP SIERRA ESPUÑA,0.0,432050.13,181030.13
2017.0,321,62200,OBRAS Y EQUIPAMIENTO EN COLEGIOS,30000.0,121901.26,120123.64
2017.0,322,22799,MEDIDAS ALTERNATIVAS EXPULSION ALUMNOS,16800.0,16800.0,16213.63
2017.0,322,48014,SUBVENCION ESCUELA OFICIAL DE IDIOMAS,3000.0,3000.0,0.0
2017.0,323,22300,TRANSPORTE DE ALUMNOS A DISTINTAS ACTIVIDADES,0.0,0.0,1558.5
2017.0,323,22602,PUBLICACION Y DIFUSION ACTIV. EDUCACION,4500.0,4500.0,4242.01
2017.0,323,22605,GTOS. FUNCION. EVENTOS Y OTROS EDUCACION,4500.0,4280.0,7902.04
2017.0,323,24000,GASTOS DE EDICION Y DISTRIBUCION,3000.0,1000.0,0.0
2017.0,323,48000,SEDE PERMANENTE UNIVERSIDAD DE MURCIA,3000.0,3000.0,0.0
2017.0,323,48001,ASOCIACION INTERNAC. DE CIUDADES EDUCADORAS,0.0,220.0,220.0
2017.0,323,48002,AYUDAS A TRANSPORTE EDUCATIVO-BUS UNIVERSITY,10000.0,10000.0,3000.0
2017.0,324,22001,BANCO DE LIBROS,16000.0,10000.0,5925.59
2017.0,324,22300,TRANSP. ACTIV. EXTRAESCOLARES Y COMPLEM.,5000.0,1800.0,1670.0
2017.0,324,22601,ATENCIONES PROTOCOLARIAS Y OBSEQUIOS EDUCACION,0.0,0.0,1471.2
2017.0,324,22606,"ESCUELA DE VERANO ""EDUCAVERANO 2017""",55000.0,26520.35,26964.67
2017.0,324,22609,TALLERES TEATRO Y CINE Y REFUERZO EDUCATIVO,23000.0,23000.0,30165.95
2017.0,324,22703,PRUEBA PILOTO INVERLINGÜE,15000.0,7578.39,0.0
2017.0,324,22704,"SERVICIO ""ZAMPATAXIS""",6000.0,6000.0,10470.92
2017.0,324,22705,SERVICIO PROXIMIDAD MATUTINO,37991.58,37991.58,34999.47
2017.0,324,22706,"ACTIV. OCIO Y TIEMPO LIBRE ""UN RATITO MAS""",59500.0,59500.0,61792.08
2017.0,324,22710,PROG. COORD. FAMILIAR NIÑOS CON N.E.A.E.,2000.0,2000.0,965.0
2017.0,324,22711,"PROGRAMA ""CONECTANDO PEDANIAS""",25000.0,25000.0,27065.8
2017.0,324,48001,"PREMIOS CONC. CUENTOS INFANT. ""JOSE CALERO HERAS""",1500.0,1500.0,650.0
2017.0,324,48002,BECAS ERASMUS E ILA,8000.0,9200.0,2600.0
2017.0,324,48003,A.M.P.A. C.E.I.P. GINES DIAZ-S.CRISTOBAL,700.0,8930.0,8230.0
2017.0,324,48004,A.M.P.A. C.E.I.P. SIERRA ESPUÑA,700.0,6211.5,5511.5
2017.0,324,48005,A.M.P.A. C.E.I.P. ANTONIO MACHADO,700.0,3914.5,3214.5
2017.0,324,48006,A.M.P.A. C.E.I.P. PRINCIPE DE ESPAÑA,700.0,5008.5,4308.5
2017.0,324,48007,A.M.P.A. C.E.I.P. NTRA. SRA. DEL ROSARIO,700.0,4621.0,3921.0
2017.0,324,48008,A.M.P.A. C.E.I.P. RICARDO CODORNIU,700.0,5689.5,4989.5
2017.0,324,48009,PROYECTOS DE AUTOR,2000.0,2000.0,0.0
2017.0,324,48015,PREMIOS A LA CULTURA DEL ESFUERZO,3000.0,3000.0,1349.99
2017.0,324,48016,SUBV. A PROYECTOS EN CENTROS EDUCATIVOS,12800.0,12800.0,12800.0
2017.0,324,62300,APARATOS AIRE ACONDICIONADO EN C.EDUCATIVOS,8000.0,8000.0,3842.01
2017.0,324,62500,EQUIP. COMPLEMENTARIO CENTROS PUBLICOS,5000.0,5000.0,2639.29
2017.0,330,12001,RETRIB. BASICAS CULTURA-A2,34579.08,34579.08,40312.82
2017.0,330,12003,RETRIB. BASICAS CULTURA-C1,23981.32,23981.32,15858.92
2017.0,330,12004,RETRIB. BASICAS CULTURA-C2,34716.45,34716.45,25767.04
2017.0,330,12100,COMPLEM. DESTINO CULTURA,48700.96,48700.96,32568.74
2017.0,330,12101,COMPLEMENTO ESPECIFICO CULTURA,54442.47,54442.47,35499.66
2017.0,330,13000,PERSONAL LABORAL FIJO CULTURA,8931.3,8931.3,0.0
2017.0,330,13100,PERSONAL LABORAL TEMPORAL CULTURA,22480.78,22480.78,20485.43
2017.0,330,15000,PRODUCTIVIDAD FUNCIONARIOS CULTURA,7365.76,7365.76,5651.14
2017.0,330,15001,PRODUCTIVIDAD LABORALES CULTURA,334.92,334.92,0.0
2017.0,330,15100,GRATIFICACIONES PERSONAL DE CULTURA,0.0,0.0,4819.25
2017.0,330,16000,SEGURIDAD SOCIAL FUNCIONARIOS  CULTURA,49633.07,49633.07,40340.44
2017.0,330,16001,SEGURIDAD SOCIAL PERS. LABORAL CULTURA,3110.3,3110.3,243.23
2017.0,3321,21600,"MTO. PROGRAMA ""ARCHIVO 3000""",1300.0,1300.0,841.88
2017.0,3321,22001,FONDO BIBLIOGRAFICO,5000.0,5000.0,6942.59
2017.0,3321,22002,MATERIAL DIDACTICO ACTIVIDADES ARCHIVO,1500.0,1500.0,163.0
2017.0,3321,22609,ACTIV. FOMENTO DE  LECTURA Y TALLERES PARA NIÑOS,3000.0,3000.0,0.0
2017.0,3321,22699,GTOS. FUNCIONAMIENTO BIBLIOTECA,2500.0,2500.0,0.0
2017.0,3321,22799,TALLERES BIBLIOTECA Y ARCHIVO,1000.0,1000.0,450.0
2017.0,3321,48000,BECAS SALAS DE ESTUDIO,3000.0,3000.0,2988.0
2017.0,3321,48001,PREMIOS CONCURSO ARCHIVO,1000.0,1000.0,0.0
2017.0,333,22105,"CATERING, AGUA Y OTROS PARA ACTIVIDADES MUSEO",0.0,0.0,108.24
2017.0,333,22601,ATENCIONES PROTOCOLARIAS DEL MUSEO ARQUEOLOGICO,2500.0,2500.0,20.06
2017.0,333,22609,ACTIVIDADES MUSEO ARQUEOLOGICO LOS BAÑOS,4500.0,4500.0,2611.0
2017.0,333,22699,GTOS. DIVERSOS MUSEO ARQUEOLOGICO LOS BAÑOS,4000.0,4000.0,568.16
2017.0,333,22799,ATENCION PUBLICO Y GUIA DEL MUSEO ARQUEOLOGICO,3000.0,1500.0,0.0
2017.0,334,20200,ARRENDAMIENTOS CINE VELASCO,34000.0,34000.0,36556.66
2017.0,334,20288,(R.E.) ARRENDAMIENTO CINE VELASCO,0.0,2500.01,2500.01
2017.0,334,21200,MTO. EDIFICIOS CULTURA,6000.0,6000.0,5133.23
2017.0,334,22000,MATERIAL OFICINA CULTURA,500.0,500.0,273.51
2017.0,334,22001,"REPORTAJES, AUDIOVISUALES, Y OTR. PUBLICACIONES",0.0,0.0,600.0
2017.0,334,22100,ENERGIA ELECTRICA EDIFICIOS CULTURA,32500.0,32500.0,32026.67
2017.0,334,22300,VIAJES CULTURALES,100.0,100.0,250.0
2017.0,334,22400,SEGUROS EXPOSICIONES CULTURA,600.0,600.0,0.0
2017.0,334,22601,GASTOS PROTOCOLO CULTURA,4500.0,4500.0,5942.12
2017.0,334,22608,TALLERES CULTURA,10190.0,10190.0,2285.68
2017.0,334,22609,TEATRO,35000.0,35000.0,51636.94
2017.0,334,22610,MUSICA,10500.0,10500.0,9420.0
2017.0,334,22611,CINE VERANO Y CURSO CINEMATOGRAFICO,3000.0,100.0,0.0
2017.0,334,22612,"GASTOS EXPOSICIONES, CONCURSOS Y CERTAMENES CULTUR",10000.0,10000.0,9557.68
2017.0,334,22613,JURADOS CERTAMENES CULTURA,2500.0,2500.0,0.0
2017.0,334,22699,GASTOS FUNCIONAMIENTO CULTURA,5000.0,5000.0,1210.54
2017.0,334,22700,LIMPIEZA EDIFICIOS CULTURA,82394.16,82394.16,75527.98
2017.0,334,22701,VIGILANCIA Y SEGURIDAD EXPOS. CULTURA,500.0,500.0,0.0
2017.0,334,22788,(R.E.) RAIDER TECNICO CINE VELASCO,0.0,2791.72,2791.72
2017.0,334,22799,RAIDER TECNICO CINE VELASCO Y OTRAS SONORIZACIONES,30000.0,30000.0,29806.22
2017.0,334,24000,GASTOS EDICION CULTURA,14200.0,14200.0,13698.64
2017.0,334,24001,"CARTELERIA, EDICIONESY DISEÑOS EXPOSICIONES Y OTR.",0.0,0.0,3694.75
2017.0,334,48000,CONVENIO JUNTA DE COFRADIAS,31875.0,31875.0,31875.0
2017.0,334,48002,CONVENIO ESCUELA DE MUSICA,72311.6,72311.6,72311.6
2017.0,334,48003,CONVENIO BANDA DE MUSICA,9000.0,9000.0,9000.0
2017.0,334,48004,CONVENIO AGRUPACION CORAL DE ALHAMA,2500.0,2500.0,2500.0
2017.0,334,48006,"PREMIOS CERTAMENES A.M.M, P.R. Y TEATRO AMATEUR",12605.0,12605.0,6964.99
2017.0,334,48007,CONVENIO GRUPO FOLKLORICO VILLA DE ALHAMA,4000.0,4000.0,4000.0
2017.0,334,48008,CONVENIO GRUPO FOLKLORICO VIRGEN DEL ROSARIO,4000.0,4000.0,4000.0
2017.0,334,48009,SUBVENCION A PROYECTOS CREATIVOS CULTURA,3000.0,3000.0,0.0
2017.0,334,48010,SUBV. PARA INSONOR. LOCALES ASOCIACIONES,20000.0,20000.0,19998.0
2017.0,334,62200,"AMPLIAC. ESCUELA DE MUSICA ""EL MATADERO""",0.0,200000.0,0.0
2017.0,334,62201,REPARAC. AUDITORIO TIERNO GALVAN. REINCORP. PMS,0.0,100000.0,0.0
2017.0,334,62500,EQUIPAMIENTO CULTURA,25000.0,39000.0,17656.31
2017.0,336,13100,PERS. L.T. EXCAV. Y RESTAURAC. CASTILLO ,0.0,121255.72,53262.27
2017.0,336,16001,SEGUR. SOCIAL PERSONAL RESTAURAC. CASTILLO II FASE,0.0,47208.6,19843.15
2017.0,336,22105,"CATERING  Y OTROS CAMPO TRABAJO ""CERRO CASTILLO""",6000.0,6000.0,4351.23
2017.0,336,22400,SEGURO PARTICIPANTES EN CAMPO DE TRABAJO EL CASTIL,0.0,0.0,191.87
2017.0,336,22609,"MAT. PROYECTOS RESTAUR. ""CASTILLO Y LAS PALERAS""",10000.0,10000.0,10251.45
2017.0,336,22688,"(R.E.) MTO. RESTAURAC. ""CASTILLO Y PALERAS""",0.0,181.5,181.5
2017.0,336,22699,"EXCAV. ARQUEOL., ESTUDIO Y MTO. YACIMIENTOS",15000.0,15000.0,5824.4
2017.0,336,22700,CATALOGO E INVENTARIO PIEZAS DEL MUSEO L.B.,0.0,4000.0,0.0
2017.0,336,22799,VISITAS GUIADAS AL CASTILLO Y OTRAS RECREACIONES,2178.0,2178.0,2771.2
2017.0,336,60900,REFORMA CASTILLO 1% CULTURAL,0.0,504146.43,0.0
2017.0,336,62300,ILUMINAC. Y CAMARAS SEGURIDAD PARA PIEZAS MUSEO L.,0.0,21000.0,20997.97
2017.0,337,12001,RETRIBUCIONES BASICAS JUVENTUD A2,0.0,0.0,16052.62
2017.0,337,12003,RETRIB. BASICAS JUVENTUD-C1,18624.53,18624.53,16054.86
2017.0,337,12004,RETRIB. BASICAS JUVENTUD-C2,9220.8,9220.8,10836.25
2017.0,337,12100,COMPLEMENTO DESTINO JUVENTUD,14630.42,14630.42,16764.76
2017.0,337,12101,COMPLEMENTO ESPECIFICO JUVENTUD,17685.41,17685.41,20178.95
2017.0,337,15000,PRODUCTIVIDAD FUNCIONARIOS JUVENTUD,2256.04,2256.04,3238.98
2017.0,337,15100,GRATIFICACIONES PERSONAL DE JUVENTUD,0.0,0.0,3805.89
2017.0,337,16000,SEGURIDAD SOCIAL FUNCIONARIOS JUVENTUD,16803.99,16803.99,24352.24
2017.0,337,22000,MATERIAL DIDACTICO JUVENTUD,500.0,500.0,80.28
2017.0,337,22101,MATERIALES Y JUEGOS LUDOTECA,500.0,500.0,437.45
2017.0,337,22199,GTOS. FUNCIONAMIENTO JUVENTUD,400.0,400.0,2.5
2017.0,337,22300,TRANSPORTE PARA ACTIVIDADES JUVENILES,0.0,0.0,249.0
2017.0,337,22602,PUBLICIDAD Y PROMOCION ACTIVIDADES JUVENILES,0.0,0.0,108.9
2017.0,337,22606,CURSOS CONCEJALIA JUVENTUD,7000.0,7000.0,5186.72
2017.0,337,22609,ACTIVIDADES Y PROGRAMAS JUVENILES,14300.0,14300.0,11946.96
2017.0,337,22700,LIMPIEZA EDIFICIOS JUVENTUD,22014.96,22014.96,20180.38
2017.0,337,22709,"CTO. LUDOTECA ""LA COMETA ALEGRE""",13100.0,13100.0,10685.52
2017.0,337,22790,SONORIZ. E ILUMINACIONES ACT. JUVENILES,4000.0,4000.0,9170.59
2017.0,337,22799,CAMPAMENTOS VERANO,6000.0,6000.0,4451.23
2017.0,337,48000,CONCURSO C.JUVENTUD,1000.0,1000.0,0.0
2017.0,337,62500,EQUIPAMIENTO JUVENTUD,6000.0,6000.0,0.0
2017.0,338,22000,MATERIAL OFICINA Y OTROS GTOS. FESTEJOS,3430.0,3430.0,1731.3
2017.0,338,22105,PRODUCTOS ALIMENTICIOS PARA  FESTEJOS,16000.0,16000.0,18470.84
2017.0,338,22111,PIROTECNIA FESTEJOS,6600.0,6600.0,6855.86
2017.0,338,22199,SUMINISTROS VARIOS ACTIV. FESTEJOS,7500.0,7500.0,6298.43
2017.0,338,22400,SEGUROS POR SUSPENSION CONCIERTOS,1500.0,1500.0,453.79
2017.0,338,22601,PREGON FERIA Y CORREMAYO MAYOR,1500.0,1500.0,914.13
2017.0,338,22608,OTRAS ACTIVIDADES DE FESTEJOS,21150.0,21150.0,31736.7
2017.0,338,22609,"ESPECTACULOS, FESTIVALES, CONCIERTOS Y OTROS",88600.0,98700.0,70086.1
2017.0,338,22699,TROFEOS Y OBSEQUIOS FESTEJOS,7420.0,7420.0,3637.42
2017.0,338,22700,"INFRAESTRUC., ESCENARIOS, CARPAS...FESTEJOS",19000.0,19000.0,10308.0
2017.0,338,22701,SERVICIOS SEGURIDAD EN FESTEJOS,17500.0,17500.0,15225.52
2017.0,338,22799,SONORIZACION E ILUMIN. EVENTOS FESTEJOS,34000.0,34000.0,61646.74
2017.0,338,24000,"EDICIONES, DISEÑOS, CARTELERIA FESTEJOS",11800.0,11800.0,17270.71
2017.0,338,48000,CONCURSOS CARTELES ANUNCIADORES FIESTAS,800.0,800.0,800.0
2017.0,338,48001,PREMIOS CARNAVAL,2660.0,4960.0,2460.0
2017.0,338,48002,"PREMIOS MAYOS, CRUCES Y ARROCES",7500.0,7500.0,6660.0
2017.0,338,48003,PREMIOS FERIA,10000.0,10000.0,9650.0
2017.0,338,48004,SUBV. A ASOCIACIONES DE BARRIOS,5000.0,5000.0,4996.6
2017.0,338,62500,EQUIPAMIENTO FESTEJOS,100.0,100.0,0.0
2017.0,340,12001,RETRIB. BASICAS DEPORTES-A2,6517.8,6517.8,0.0
2017.0,340,12003,RETRIB. BASICAS DEPORTES-C1,27265.24,27265.24,31715.6
2017.0,340,12004,RETRIB. BASICAS DEPORTES-C2,4231.23,4231.23,0.0
2017.0,340,12005,RETRIB. BASICAS DEPORTES-E,7950.56,7950.56,0.0
2017.0,340,12100,COMPLEMENTO DESTINO DEPORTES,23757.51,23757.51,12702.69
2017.0,340,12101,COMPLEMENTO ESPECIFICO DEPORTES,27289.57,27289.57,14046.7
2017.0,340,15000,PRODUCTIVIDAD FUNCIONARIOS DEPORTES,3637.95,3637.95,2185.24
2017.0,340,15100,GRATIFICACIONES PERSONAL DE DEPORTES,0.0,0.0,6866.75
2017.0,340,16000,SEGURIDAD SOCIAL FUNCIONARIOS DEPORTES,24741.46,24741.46,17145.01
2017.0,341,22000,MATERIAL DE OFICINA DEPORTES,0.0,0.0,204.13
2017.0,341,22104,VESTUARIO DEPORTE ESCOLAR MILLA URBANA,2000.0,2000.0,3090.34
2017.0,341,22105,CATERING ACTIVIDADES DEPORTIVAS,0.0,0.0,2552.82
2017.0,341,22199,MATERIAL DEPORTIVO,3000.0,3000.0,3745.95
2017.0,341,22203,APLICACION INFORMATICA GESTION DEPORTIVA,0.0,0.0,1099.82
2017.0,341,22300,TRANSPORTE DEPORTE ESCOLAR Y OTROS,5500.0,5500.0,2358.2
2017.0,341,22400,SEGUROS ACTIVIDADES DEPORTIVAS,1000.0,1000.0,0.0
2017.0,341,22602,PUBLICIDAD Y PROPAGANDA DEPORTES,0.0,0.0,500.0
2017.0,341,22609,ACTIVIDADES DEPORTIVAS Y ASES. GIMNASIO,42952.87,42952.87,49038.09
2017.0,341,22610,PROGRAMA DEPORTE ESCOLAR,26000.0,26000.0,25107.5
2017.0,341,22699,GTOS. DIVERSOS DEPORTES,13800.0,13800.0,18070.9
2017.0,341,22701,CTO. GESTION INTEGRAL CONSERJERIA,230000.0,199600.0,194454.36
2017.0,341,22706,REDACC. PROYECTOS Y ESTUDIOS TECNICOS DEPORTES,0.0,0.0,3484.8
2017.0,341,22799,CTO. GESTION INTEGRAL PISCINA,255123.0,233123.0,232966.19
2017.0,341,24000,"EDICIONES, FOLLETOS Y CARTELERIA DEPORTES",0.0,0.0,2388.35
2017.0,341,48002,TRANSFERENCIAS PROGRAMA DEPORTES,50625.0,50625.0,50625.0
2017.0,341,48003,CONVENIO ASOC. DE CLUBES DEPORTIVOS,25000.0,25000.0,25000.0
2017.0,341,48004,CONVENIO MOTOCLUB ALHAMA,12000.0,12000.0,12000.0
2017.0,3421,21300,MTO. INSTALACIONES DEPORTIVAS,63500.0,62139.72,47314.76
2017.0,3421,21388,(R.E.) MTO. INSTALACIONES DEPORTIVAS,0.0,1584.01,1584.01
2017.0,3421,22100,ENERGIA ELECTRICA EDIFICIOS DEPORTES,120000.0,120000.0,110132.27
2017.0,3421,22102,GAS PISCINA Y POLIDEPORT. PRAICO,20000.0,20000.0,25594.83
2017.0,3421,22103,COMBUSTIBLE PABELLON Y POLID. GUADALENTIN,11400.0,11400.0,9622.34
2017.0,3421,22700,LIMPIEZA EDIFICIOS DEPORTES,110544.48,110544.48,101332.44
2017.0,3421,62200,OBRAS E INSTALACIONES DEPORTIVAS,10000.0,400.0,0.0
2017.0,3421,62201,OBRAS DE REPARACION EN PABELLON ADOLFO SUAREZ,0.0,120000.0,0.0
2017.0,3421,62301,"LAMPARAS, EQUIPOS ELECTR. Y REDES POLIDEP. PRAICO",0.0,2035.13,0.0
2017.0,3421,62400,INSTALACIONES DEPORTIVAS,0.0,600000.0,0.0
2017.0,414,21000,MANT. DIVERSAS INFRAESTRUCTURAS EN PEDANIAS,5000.0,5000.0,9767.02
2017.0,414,22001,"PRENSA, REVISTAS Y OTR. CENTROS SOCIALES PEDANIAS",0.0,0.0,316.23
2017.0,414,22100,ENERGIA ELECTRICA EDIFICIOS PEDANIAS,7700.0,7700.0,8258.7
2017.0,414,22300,TRANSP. BANDA MUSICA Y OTROS VIAJES PEDANIAS,1500.0,1200.0,528.0
2017.0,414,22301,APOYO TRANSPORTE COLECTIVO PEDANIAS,12000.0,5401.44,4646.68
2017.0,414,22388,(R.E.) APOYO TRANSPORTE COLECTIVO A PEDANIAS,0.0,485.85,485.85
2017.0,414,22601,TROFEOS Y OBSEQUIOS PEDANIAS,500.0,500.0,646.01
2017.0,414,22602,PUBLICIDAD Y PROPAGANDA PEDANIAS,0.0,0.0,302.5
2017.0,414,22606,TALLERES PEDANIAS,15500.0,11700.0,11697.6
2017.0,414,22609,ACTIVIDADES CULTURALES PEDANIAS,4500.0,4500.0,4131.06
2017.0,414,22699,GASTOS DIVERSOS PEDANIAS,5000.0,5000.0,2915.9
2017.0,414,22700,LIMPIEZA EDIFICIOS PEDANIAS,29567.52,29567.52,27103.56
2017.0,414,22701,"CONSERJES,  MTO. INTERNET RURAL",4920.0,4920.0,2520.0
2017.0,414,22788,(R.E.) CONSERJES MTO. INTERNET RURAL,0.0,210.0,210.0
2017.0,414,24000,EDICIONES Y CARTELERIA PEDANIAS,500.0,500.0,0.0
2017.0,414,48000,SUBVENCION FIESTAS PEDANIA LAS CAÑADAS,3000.0,3000.0,3000.0
2017.0,414,48001,SUBVENCION FIESTAS PEDANIA EL CAÑARICO,3000.0,3000.0,3000.0
2017.0,414,48002,SUBVENCION FIESTAS PEDANIA LA COSTERA,3000.0,3000.0,3000.0
2017.0,414,48003,SUBVENCION FIESTAS PEDANIA DE GEBAS,3000.0,3000.0,3000.0
2017.0,414,48004,SUBVENCION FIESTAS PEDANIA DE EL BERRO,3000.0,3000.0,3000.0
2017.0,414,48005,SUBVENCION NAVIDAD PEDANIA LAS CAÑADAS,500.0,500.0,500.0
2017.0,414,48006,SUBVENCION NAVIDAD PEDANIA EL CAÑARICO,500.0,500.0,500.0
2017.0,414,48007,SUBVENCION NAVIDAD PEDANIA LA COSTERA,500.0,500.0,500.0
2017.0,414,48008,SUBVENCION NAVIDAD PEDANIA DE GEBAS,500.0,500.0,500.0
2017.0,414,48009,SUBVENCION NAVIDAD PEDANIA DE EL BERRO,500.0,500.0,500.0
2017.0,414,48010,"AUTO DE REYES ""ASOC. VECINOS EL BERRO""",2500.0,2500.0,2500.0
2017.0,414,48011,"ENCUENTRO CUADRILLAS ""ASOC. CUADRILLAS EL BERRO""",3500.0,3500.0,3500.0
2017.0,414,48012,"DINAM. Y FUNCION. ""ASOC. VECINOS EL BERRO""",450.0,450.0,450.0
2017.0,414,48013,"DINAMIZ. Y FUNCIONAM. ""ASOC. ABEDUL EL BERRO""",450.0,450.0,450.0
2017.0,414,48014,"DINAM. Y FUNC. ""ASOC. VECINOS LA COSTERA""",900.0,900.0,900.0
2017.0,414,48015,"DINAM. Y FUNC. ""ASOC. VECINOS EL CAÑARICO""",900.0,900.0,900.0
2017.0,414,48016,"DINAM. Y FUNC. ""ASOC. VECINOS GEBAS""",900.0,900.0,900.0
2017.0,414,48017,"DINAM. Y FUNC. ""ASOC. VECINOS LAS CAÑADAS""",900.0,900.0,900.0
2017.0,414,61900,PARDOS 2016: PAVIM. PLAT. UNICA Y ABASTEC. EN BERR,0.0,61425.0,56743.13
2017.0,414,62500,EQUIPAMIENTO Y OBRAS EN  PEDANIAS,30000.0,26928.75,12996.97
2017.0,422,21000,CUOTA MTO. PARQUE INDUSTRIAL,4900.0,4900.0,3204.72
2017.0,422,21088,(R.E.) CUOTA MTO. PARQUE INDUSTRIAL,0.0,733.68,733.68
2017.0,422,22688,(R.E.) PUBLICIDAD Y PROPAG. PARQUE INDUSTRIAL,0.0,242.0,242.0
2017.0,422,48000,CONVENIO ENTIDAD URBANISTICA E.U.C.P.I.A,34000.0,34000.0,34000.0
2017.0,422,48001,CONVENIO INDUSTRIALHAMA-FORMACION,3000.0,3000.0,3000.0
2017.0,422,62500,EQUIPAMIENTO INDUSTRIA,100.0,100.0,0.0
2017.0,422,77000,CONVENIO INDUSTRIALHAMA-CAPITAL,20000.0,20000.0,20000.0
2017.0,430,12001,RETRIB. BASICAS TURISMO Y COMERCIO-A2,14926.24,14926.24,16606.19
2017.0,430,12004,RETRIB. BASICAS TURISMO Y COMERCIO-C2,8968.02,8968.02,9715.93
2017.0,430,12100,COMPL. DESTINO TURISMO Y COMERCIO,11762.24,11762.24,10782.6
2017.0,430,12101,COMPL. ESPEC. TURISMO Y COMERCIO,12050.67,12050.67,10189.3
2017.0,430,13100,PERSONAL LABORAL TEMPORAL TURISMO,0.0,0.0,11297.75
2017.0,430,15000,PRODUCT. FUNC.  TURISMO Y COMERCIO,1789.02,1789.02,1731.72
2017.0,430,16000,SEG. SOCIAL FUNC. TURISMO Y COMERCIO,13086.64,13086.64,15453.78
2017.0,430,16001,SEGURIDAD SOCIAL TURISMO LABORALES,0.0,0.0,172.65
2017.0,4310,22000,"PROGRAMA ""ALHAMA LIMPIA Y RECICLA""",6000.0,0.0,0.0
2017.0,4310,22100,ENERGIA ELECTRICA EDIFICIOS COMERCIO,1900.0,1900.0,1452.26
2017.0,4310,22199,SUMINISTRO DE DISTINTIVOS COMERCIO LOCAL,14000.0,0.0,0.0
2017.0,4310,22606,CURSO FORMACION COMERCIO Y HOSTELERIA,2000.0,2000.0,605.0
2017.0,4310,22699,GTOS. DIVERSOS COMERCIO,5000.0,1200.0,1227.57
2017.0,4310,22700,LIMPIEZA EDIFICIOS COMERCIO,11061.36,11061.36,10139.58
2017.0,4310,48000,CONVENIO ASOCIACION COMERCIANTES,6000.0,6000.0,6000.0
2017.0,4310,48001,PREMIOS CONCURSO COMERCIANTES,1500.0,1500.0,1500.0
2017.0,4311,22105,CATERING FERIAS Y EXPOSICIONES AGRICULTURA,3000.0,3000.0,3081.5
2017.0,4311,22188,(R.E.) CATERING FERIAS Y EXPOSIC. AGRICULTURA,0.0,15.5,15.5
2017.0,4311,22601,ATENCIONES PROTOCOLARIAS COMERCIO ,0.0,0.0,362.76
2017.0,4311,22602,CAMPAÑAS PROMOCIONALES COMERCIO,0.0,0.0,2755.17
2017.0,4311,22606,FERIA ARTESANIA GREMIO ARTESANOS,1000.0,1000.0,400.0
2017.0,4311,22609,FERIAS Y EXPOSICIONES COMERCIO Y  AGRICULTURA,5000.0,5000.0,2281.31
2017.0,4311,22610,"PROGRAMA ""ALHAMA EN LA CALLE""",5000.0,5000.0,4372.99
2017.0,4311,22799,"SONORIZACIÓN, ILUMINACION, FERIAS  Y EXPOSICIONES ",0.0,0.0,3950.65
2017.0,4311,24000,"EDICIONES, FOLLETOS Y CARTELES COMERCIO",4000.0,3600.0,1684.08
2017.0,4312,21200,MANTENIMIENTO PZA.ABASTOS Y MERCADO,0.0,0.0,1109.76
2017.0,4312,62200,CUBIERTA BIOCLIMATICA PLAZA EN MERCADO MUNICIPAL,0.0,135105.19,86340.09
2017.0,4312,62900,REHABILITAC. ASEOS E ILUMINAC. LED PZA. ABASTOS,0.0,3788.83,0.0
2017.0,432,20300,SONORIZ. SERENATA Y OTROS S.SANTA,1300.0,1300.0,900.0
2017.0,432,21200,MTO. Y CONSERVACION OFICINA DE TURISMO,0.0,0.0,41.1
2017.0,432,21900,"""Q CALIDAD TURISTICA"" MARCA Y SUSCRIPCION",1250.0,1250.0,803.44
2017.0,432,22100,ENERGIA ELECTRICA EDIFICIOS TURISMO,1600.0,1600.0,1817.25
2017.0,432,22104,VESTUARIO PERSONAL INFORMACION Y TURISMO,200.0,200.0,36.3
2017.0,432,22199,SEÑALIZ. RUTA TURISTICA Y OTROS GTOS.,4500.0,4500.0,0.0
2017.0,432,22299,DESARROLLO APLICACIONES DIFUSION TURISTICA y OTROS,3500.0,3500.0,600.0
2017.0,432,22601,GASTOS DE PROMOCION TURISTICA,0.0,0.0,7295.16
2017.0,432,22602,PUBLICIDAD PROMOC. Y DIFUSION INTERES TURISTICO,10800.0,14914.0,12354.1
2017.0,432,22609,VISITAS TURISTICAS Y GUIAS,13000.0,13000.0,9269.75
2017.0,432,22699,GASTOS DIVERSOS TURISMO,1000.0,1000.0,399.0
2017.0,432,22700,SERV. PROFESIONALES PARA ATENDER OFIC. TURISMO,11886.84,11886.84,22783.11
2017.0,432,22701,ESTUDIOS PARA MEJORA DEL USO PUBL. TURISTICO,6534.0,6534.0,6534.0
2017.0,432,22702,LIMPIEZA EDIFICIOS TURISMO,322.92,322.92,296.01
2017.0,432,22799,CTOS. TRADUCCION Y MTO. WED TURISTICA,4000.0,4000.0,3327.5
2017.0,432,24000,EDICIONES Y FOLLETOS C.TURISMO,8000.0,8000.0,2179.82
2017.0,432,48001,BECAS PERSONAL TURISMO,6000.0,6000.0,4520.0
2017.0,432,48002,"APORTACION "" VIAS VERDES""",5000.0,5000.0,4970.7
2017.0,432,48003,APORTAC. MANCOMUNIDAD TURISTICA S.ESPUÑA,36646.96,36646.96,36646.96
2017.0,432,62500,EQUIPAMIENTO TURISMO,2000.0,2000.0,949.64
2017.0,450,12003,RETRIBUCIONES BASICAS BRIGADAS-C1,19967.64,19967.64,0.0
2017.0,450,12004,RETRIBUCIONES BASICAS BRIDADAS-C2,92094.3,92094.3,54189.71
2017.0,450,12005,RETRIBUCIONES BASICAS BRIGADAS-E,150595.24,120076.27,149476.22
2017.0,450,12100,COMPLEMENTO DESTINO BRIGADAS,134698.93,74698.93,75616.48
2017.0,450,12101,COMPLEMENTO ESPECIFICO BRIGADAS,212991.91,156991.91,121269.08
2017.0,450,13100,PERS. LABORAL TEMPORAL BRIGADAS,13880.72,13880.72,20882.66
2017.0,450,15000,PRODUCTIVIDAD FUNCIONARIOS BRIGADAS,21619.83,21619.83,60706.07
2017.0,450,15100,GRATIFICACIONES PERSONAL DE BRIGADAS,0.0,0.0,1568.69
2017.0,450,16000,SEGURIDAD SOCIAL FUNCIONARIOS BRIGADAS,170293.79,130293.79,135015.72
2017.0,450,16001,SEGURIDAD SOCIAL PERS. LABORAL BRIGADAS,930.01,930.01,5861.57
2017.0,450,20400,ARRENDAMIENTO DE VEHICULOS Y OTR. MAT. DE TRANSPOR,0.0,0.0,530.28
2017.0,450,21300,MTO. MAQUINARIA Y UTILLAJE BRIGADAS,4500.0,4500.0,1655.16
2017.0,450,21388,(R.E.) MTO. MAQUINARIA Y UTILLAJE BRIGADAS,0.0,271.89,271.89
2017.0,450,21400,MTO. VEHICULOS BRIGADAS,30000.0,30000.0,32083.75
2017.0,450,21488,(R.E.) MTO. VEHICULOS BRIGADAS,0.0,651.34,651.34
2017.0,450,21600,PROGRAMA INFORMATICO GESTION BRIGADAS,3025.0,3025.0,3292.5
2017.0,450,22103,COMBUSTIBLE VEHICULOS BRIGADAS,19000.0,19000.0,14339.4
2017.0,450,22104,VESTUARIO PERSONAL BRIGADAS,8000.0,8000.0,8760.57
2017.0,450,22188,(R.E.) COMBUSTIBLE VEHICULOS BRIGADAS,0.0,1354.68,1354.68
2017.0,450,22189,(R.E.) SUMINISTROS BRIGADAS,0.0,14.9,14.9
2017.0,450,22199,MATERIALES Y SUMINISTROS BRIGADAS,18000.0,18000.0,13094.78
2017.0,450,22700,LIMPIEZA EDIFICIOS BRIGADAS,605.52,605.52,555.06
2017.0,450,61900,EQUIPAMIENTO BRIGADAS,100.0,100.0,0.0
2017.0,450,62400,VEHICULO CAMION GRUA BRIGADAS,40000.0,70180.0,0.0
2017.0,450,62500,"ESCENARIO HOMOL., MESA Y HERRAMIENTAS BRIGADAS",25000.0,1418.56,1418.56
2017.0,454,21001,MEJORA RED VIARIA-BACHEOS,30000.0,30000.0,20672.13
2017.0,454,22104,DESBROCE Y TRAT. FITOSANITARIO CAMINOS,7500.0,7500.0,20823.07
2017.0,454,22501,TASA OCUPAC. TERRENOS FORESTALES Y RED CTRAS.,1500.0,1500.0,4126.31
2017.0,454,61900,EQUIPAMIENTO CAMINOS VECINALES,1000.0,1000.0,823.32
2017.0,454,62100,PLAN ASFALTO 2017,0.0,60000.0,42834.0
2017.0,454,62101,PAVIMENTAC. CAMINOS PUBLICOS. PLAN 2017,0.0,60000.0,45605.66
2017.0,454,62901,CUNETA DE HORMIGON CAMINO CABEZUELAS,4400.0,4400.0,4128.19
2017.0,491,12003,RETRIB. BASICAS N.TEGNOLOGIAS-C1,29976.03,29976.03,14867.77
2017.0,491,12004,RETRIB. BASICAS N.TEGNOLOGIAS-C2,27121.02,27121.02,42411.15
2017.0,491,12100,RETRIB.COMPLEMENT.PERSONAL INFORMATICA,37793.21,37793.21,24649.27
2017.0,491,12101,COMPLEMENTO ESPECIFICO NUEVAS TECNOLOG.,54818.71,54818.71,37027.13
2017.0,491,15000,PRODUCTIVIDAD FUNCIONARIOS N. TEGNOLOGIAS,5614.09,5614.09,7616.81
2017.0,491,15100,GRATIFICACIONES PERSONAL DE NUEVAS TECNOLOGIAS,0.0,0.0,10166.3
2017.0,491,16000,SEGURIDAD SOCIAL FUNCIONARIOS N.TEGNOLOGIAS,39268.33,39268.33,37748.54
2017.0,491,21300,MTO. CENTRO PROCESO DE DATOS,50170.0,11974.97,0.0
2017.0,491,21301,MANTENIMIENTO Y REPARACION  MAQUINARIA NUEVAS TECN,0.0,0.0,0.0
2017.0,491,22000,CONSUMIBLES INFORMATICOS,8000.0,8000.0,2574.7
2017.0,491,22701,CERTIFICADOS DIGITALES,1500.0,1500.0,1655.34
2017.0,491,22702,MTO. WED MUNICIPAL,15000.0,15000.0,12100.0
