#AÑO,CODFUNCION,CODECOPART,NOMPARTIDA,Inicial,Actual,O
2017.0,491,22706,MTO. PROGRAMAS INFORMATICOS,55000.0,55000.0,68525.69
2017.0,491,22708,"CREACION WED ""PLATAFORMA GOBIERNO ABIERTA""",2500.0,2500.0,0.0
2017.0,491,22709,ADMINISTRACION-INFORMACION URBANISTICA,0.0,0.0,5445.0
2017.0,491,22788,(R.E.) MANTENIMIENTO WEB MUNICIPAL,0.0,1210.0,1210.0
2017.0,491,62600,ADQUISICION EQUIPOS INFORMATICOS,20000.0,86495.03,19028.7
2017.0,493,22699,ACTIVIDADES DE DIVULGACION AL CONSUMIDOR,467.72,467.72,0.0
2017.0,493,22799,GESTION OMIC,18832.28,18832.28,18832.07
2017.0,493,62500,EQUIPAMIENTO CONSUMO,300.0,300.0,0.0
2017.0,912,10000,RETRIB. ORGANOS DE GOBIERNO,179267.67,169527.48,165423.48
2017.0,912,11000,PERSONAL CONFIANZA ORG. GOBIERNO,27345.42,27345.42,27462.66
2017.0,912,15001,PRODUCTIVIDAD PERSONAL CONFIANZA,1025.45,1025.45,1171.83
2017.0,912,16001,SEG. SOCIAL PERSONAL CONFIANZA,8777.88,8777.88,9041.9
2017.0,912,16002,SEG. SOCIAL ORGANOS DE GOBIERNO,55393.71,54173.9,52058.55
2017.0,912,16200,FORMACION Y PERFECCIONAMIENTO ORGANOS GOBIERNO,0.0,0.0,300.0
2017.0,912,22101,SUMINISTRO AGUA PLENO,200.0,200.0,150.48
2017.0,912,22601,ATENCIONES PROTOCOLARIAS ORG. GOBIERNO,10500.0,10500.0,5209.85
2017.0,912,22699,ACTOS INSTITUCIONALES E IMPREVISTOS,8000.0,8000.0,0.0
2017.0,912,23000,DIETAS ORGANOS GOBIERNO,900.0,900.0,1508.71
2017.0,912,23100,LOCOMOCION ORGANOS GOBIERNO,900.0,900.0,1974.6
2017.0,912,23300,ASISTENCIAS  MIEMBROS GOBIERNO,23520.0,30160.0,30020.0
2017.0,912,23301,ASISTENCIAS RESTO MIEMBROS  CORPORACION,53280.0,57600.0,61820.0
2017.0,912,24000,EDICIONES  Y PUBLICACIONES ORGANOS GOBIERNO,900.0,900.0,0.0
2017.0,912,48004,ALCALDE PEDANEO DE EL BERRO,900.0,900.0,900.0
2017.0,912,48005,ALCALDE PEDANEO DE GEBAS,900.0,900.0,900.0
2017.0,912,48006,ALCALDE PEDANEO DE EL CAÑARICO,900.0,900.0,900.0
2017.0,912,48007,ALCALDE PEDANEO DE LA COSTERA,900.0,900.0,900.0
2017.0,912,48008,ALCALDE PEDANEO DE LA CAÑADAS,900.0,900.0,900.0
2017.0,912,48010,CELEBRACION DOCE OCTUBRE,750.0,750.0,0.0
2017.0,912,49000,DOTACION ECONOMICA P.P.,12200.0,12200.0,12120.0
2017.0,912,49001,DOTACION ECONOMICA C`S,8520.0,8520.0,8520.0
2017.0,912,49002,DOTACION ECONOMICA P.S.O.E,13560.0,13560.0,13560.0
2017.0,912,49003,DOTACION ECONOMICA I.U.,9240.0,9240.0,9240.0
2017.0,920,12000,RETRIB. BASICAS ADMON. GRAL.-A1,35349.64,35349.64,56725.67
2017.0,920,12001,RETRIB. BASICAS ADMON. GRAL.-A2,37315.6,37315.6,16966.97
2017.0,920,12003,RETRIB. BASICAS ADMON. GRAL.-C1,35059.78,35059.78,30042.9
2017.0,920,12004,RETRIB. BASICAS ADMON. GRAL.-C2,68590.08,68590.08,64382.14
2017.0,920,12005,RETRIB. BASICAS ADMON. GRAL.-E,23143.64,23143.64,22985.97
2017.0,920,12100,COMPLEMENTO DESTINO ADMON. GRAL.,113575.42,113575.42,88782.26
2017.0,920,12101,COMPLENTO ESPECIFICO ADMON. GRAL,161585.82,116585.82,113803.12
2017.0,920,13100,PERSONAL LABORAL TEMPORAL ADMON. GRAL,62264.55,62264.55,71006.59
2017.0,920,15000,PRODUCTIVIDAD FUNCIONARIOS ADMON. GRAL,16838.24,16838.24,21870.97
2017.0,920,15001,PRODUCTIVIDAD LABORALES ADMON. GRAL.,2334.92,2334.92,5316.82
2017.0,920,15100,GRATIFICACIONES PERSONAL ADMON. GRAL.,0.0,0.0,573.1
2017.0,920,16000,SEGURIDAD SOCIAL FUNCIONARIOS ADMON. GRAL.,125243.31,125243.31,98926.08
2017.0,920,16001,SEG. SOCIAL PERSONAL LABORAL ADMON. GRAL.,19986.92,19986.92,29887.44
2017.0,920,21200,MANTENIMIENTO DE EDIFICIOS E INSTALAC. PUBLICAS,70000.0,66171.37,3615.54
2017.0,920,21300,MTO. MAQUINARIA ADMON. GRAL,110000.0,110000.0,83131.98
2017.0,920,21388,(R.E.) MTO. MAQUINARIA ADMON. GRAL.,0.0,1168.59,1168.59
2017.0,920,22000,MATERIAL DE OFICINA ADMON.GRAL.,15000.0,15000.0,8871.06
2017.0,920,22001,"PRENSA, REVISTAS, LIBROS ADMON. GRAL.",10000.0,10000.0,6802.13
2017.0,920,22088,(R.E.) MATERIAL DE OFICINA,0.0,899.81,899.81
2017.0,920,22100,SUMINISTRO ENERGIA ELECTRICA,68200.0,68200.0,76967.77
2017.0,920,22101,"SUMIN. PUNTOS ELECTRICOS WIFI, FIBRA OPTICA",0.0,0.0,2122.79
2017.0,920,22112,MATERIAL ELECTRONICO Y DE TELECOMUNICACIONES,1000.0,1000.0,1488.94
2017.0,920,22200,COMUNICACIONES TELEFONICAS ADMON. GRAL,37000.0,37000.0,48551.4
2017.0,920,22201,COMUNICACIONES POSTALES Y MENSAJERIA,40000.0,40000.0,41792.45
2017.0,920,22288,(R.E.) COMUNICACIONES TELEFONICAS,0.0,3126.5,3126.49
2017.0,920,22289,(R.E.) COMUNICACIONES POSTALES Y MENSAJERIA,0.0,7.95,7.95
2017.0,920,22400,PRIMAS DE SEGUROS,61340.66,61340.66,22406.71
2017.0,920,22500,"TRIBUTOS, TASAS Y OTROS",20000.0,20000.0,22142.56
2017.0,920,22588,"(R.E.) TRIBUTOS, TASAS Y OTROS",0.0,1180.62,1069.92
2017.0,920,22602,PUBLICIDAD Y PROPAGANDA ADMON. GRAL,39000.0,39000.0,41319.48
2017.0,920,22604,GTOS. JURIDICOS Y CONTENCIOSOS,2500.0,2500.0,320.9
2017.0,920,22607,GASTOS POR OPOSICIONES Y PRUEBAS SELECTIVAS,0.0,0.0,1190.0
2017.0,920,22688,(R.E.) PUBLICIDAD Y PROPAGANDA ADMON. GRAL.,0.0,1500.0,1500.0
2017.0,920,22699,"MUPIS, ROLL-UP Y OTROS PARA EVENTOS MUNICIPALES",0.0,0.0,12142.71
2017.0,920,22700,LIMPIEZA DE EDIFICIOS MPALES.,22072.68,22072.68,20233.29
2017.0,920,22701,SERVICIO ASESORAM. JURIDICO A CONSUMIDORES,0.0,0.0,6693.09
2017.0,920,22702,PRTOS. PART. ASISTENCIAS TECNICAS,18000.0,18000.0,0.0
2017.0,920,22703,DISTINTAS ASISTENCIAS Y LICENCIAS INFORMATICAS,6000.0,6000.0,34775.17
2017.0,920,22704,MTO. Y GESTION PROGR. INFORMATICOS NOMINA Y R.H.,0.0,0.0,13949.86
2017.0,920,22705,CTO. SERVICIOS EN DISTINTOS CENTROS MPALES.,68000.0,68000.0,15850.03
2017.0,920,22706,SERV. ASESORAMIENTO Y DEFENSA JURIDICA,39900.0,39900.0,42595.67
2017.0,920,22707,SERV. CONSULTORIA Y ASISTENCIA ECONOMICO FINANCIER,0.0,0.0,8772.5
2017.0,920,22709,ATENC. INTEGRAL DE TAREAS DE SECRETARIA DE ALCALDI,0.0,0.0,5082.0
2017.0,920,22799,PREVENC. RIESGOS LABORALES Y VIGILANCIA SALUD,23500.0,23500.0,21893.65
2017.0,920,23020,DIETAS ADMON. GRAL.,1000.0,1000.0,437.0
2017.0,920,23120,LOCOMOCION ADMON. GRAL.,6800.0,6800.0,1860.17
2017.0,920,23300,ASISTENCIA A TRIBUNALES,8000.0,8000.0,10800.48
2017.0,920,23301,OTRAS INDEMNIZACIONES,6000.0,6000.0,1054.53
2017.0,920,23302,INDEMNIZACIONES RESPONSABILIDAD PATRIMONIAL,10000.0,10000.0,0.0
2017.0,920,24000,PUBLICACIONES EN EL BORM,18000.0,18000.0,7269.71
2017.0,920,60000,INVERSION PTOS. PARTICIPAT. DE INTERES GENERAL,0.0,75000.0,0.0
2017.0,920,62300,MAQUINARIA Y OTRAS INVERSIONES,1000.0,4828.63,740.82
2017.0,920,62700,PRTOS. PARTICIPATIVOS. PROGRAMAS ACTUACION,15000.0,15000.0,0.0
2017.0,920,62702,PRTOS. PARTICIPATIVOS. ACTUAC. SELECC. 2017,36546.62,36546.62,0.0
2017.0,920,62900,MEDIDAS SEGURIDAD EDIFICIOS Y ESP. PUBLICOS,6000.0,6000.0,0.0
2017.0,931,12000,RETRIB. BASICAS ADMON. FINANC.-A1,31358.8,31358.8,8668.12
2017.0,931,12001,RETRIB. BASICAS ADMON. FINANC.-A2,17762.2,17762.2,21020.6
2017.0,931,12003,RETRIB. BASICAS ADMON. FINANC.-C1,37978.82,37978.82,33374.87
2017.0,931,12004,RETRIB. BASICAS ADMON. FINANC.-C2,40197.54,40197.54,47543.49
2017.0,931,12005,RETRIB. BASICAS ADMON. FINANC.-E,9409.84,9409.84,11221.04
2017.0,931,12100,COMPLEMENTO DESTINO ADMON. FINANC.,86756.3,86756.3,68199.1
2017.0,931,12101,COMPLEMENTO ESPECIFICO ADMON. FINANC.,123267.66,102464.99,76281.85
2017.0,931,15000,PRODUCTIVIDAD FUNCIONARIOS ADMON. FINANCIERA,13002.42,13002.42,11741.56
2017.0,931,16000,SEGURIDAD SOCIAL FUNCIONARIOS ADMON. FINANC.,87514.26,87514.26,67454.89
2017.0,932,22500,GASTOS DE GESTION POR RECAUDACION DE TASAS E IMPUE,0.0,0.0,4833.95
2017.0,932,22703,ASISTENCIA INFORMATICA TAO,5000.0,5000.0,2178.0
2017.0,932,22706,VALORACIONES Y PERITAJES DE INMUEBLES,5000.0,5000.0,1669.8
2017.0,932,22708,GESTION INGRESOS MUNICIPALES,770285.24,770285.24,716167.36
2017.0,941,46600,FEDERACION MUNICIPIOS R.MURCIA,5764.77,5764.77,5327.0
2017.0,944,46600,FEDERACION ESPAÑOLA MUNICIPIOS Y PROVINCIAS,1199.08,1202.06,1202.06
